万里千里,老师讲课很好,5.0
cuizimu1996163com,张铭老师讲课实在是太菜了。举个例子《外排序》：第一页，“外排序是对磁盘（文件）进行排序”。什么叫对文件排序？是把文件按大小排序？还是按文件名排序？事实上都错了，她的意思是某一个文件的内容进行排序。可文件不就是一个很长的二进制串么？对一个二进制串咋排序？把1都放左边把0都放右边？都错了，她的意思是对一个记录型文件里面记录排序。“形成一个尽可能长的初始顺串”。尽可能长是什么意思？文件是多长就是多长，4KB就是4KB，还能尽可能长？第二页，用堆处理。“这就形成了一个初始的堆”。这啥玩意，这怎么就形成一个堆了？堆里的初始元素哪来的？随机生成的？综上所述，这个视频完全就是给学过这门课的人复习用，没学过的人各种听不懂，根本没讲明白。,1.0
LittleWei,额。。说实话咧，感觉讲得不是很好，前面有点重复啰嗦，而且没把握好进度，感觉不能循序渐进，不是很清晰。但是老师们都很用心在讲课看得出来，希望能做得更好一些吧！,3.0
马德兰公爵,不好自己看书吧,2.0
0174306,不好，体验很差，老师没有逻辑,1.0
思久方为远见,不适合预习用，语言太抽象，很多地方仅仅是念课件。,2.0
张铭,课程内容前沿实用！助教团队超级棒！论坛讨论活跃,5.0
TBNSmartyee,感觉很混乱,2.0
萝卜ykt1507092835724,讲的真的烂，一直会停，有点拖拉。,2.0
快乐的公民,总体来说，难度适中，可以学习到有许许多多的边边角角的知识，oj的内容更是非常的实在，有模板，可以节省许多不必要的时间，强烈推荐，非常适合初级阶段的学者,5.0
貌似狠簡單mooc,讲解不够清楚,2.0
化学生学cs,递归讲得莫名其妙，前后逻辑不清晰，语言组织令人失望。。。。。,2.0
mooc1469883492426,感觉讲得好乱。。。,2.0
1700012895,我输入了七个字,5.0
1700012710,课程很好，老师讲得都很精彩,5.0
14846,为陈老师疯狂打call！！！,5.0
mooc68587144046193473,！！！！！很棒,5.0
HeavyCrab,一些没必要扣的定义类的东西真的可以略去。很多定义和平时人们在用的也不一样。一些算法像KMP之类的，写法又比较奇怪。什么“优化后的KMP”，所谓的优化仅仅是特判掉了相同字母的情况，别说复杂度，就连常数因子都没有改善，这类东西让人觉得不知所云。,1.0
Little_Blue,我觉得不错,5.0
mooc1530938506519,非常非常清楚,5.0
公管162016311684付峻豪,棒！强烈推荐,5.0
mooc1522722385562,为陈老师的课程疯狂打call！,5.0
toaruj,陈斌老师的pyyhon非常有趣，讲的算法也有一定深度，作业还可以刺激艺术细胞，妙啊,5.0
YukkuriC,内容丰富，考察全面,5.0
耿小白,让我学会了很多算法知识，对编程更加有兴趣了,5.0
慕士塔格ykt1422784516166,数据结构：算法，逻辑，存储。结构：是表示实体与关系的。存储结构：线性，连接，索引，哈希,5.0
xigesi163com,我觉得知识点讲解的很细，听起来能感觉到张老师花费了很大心思，只是我没有一点相关基础，听起来比较费劲，一定要坚持听。,5.0
zhangshitian,还好啊，就是测验比较难。,5.0
NovakChan,老师经常出现，助教大大们也很热心的棒我们解决问题，学到就是赚到,5.0
weiyanyan,慕课老师将的详细，与真实的课堂老师讲的内容互补，让我知道了更多知识,5.0
Leonard11,老师讲课非常好，课程作业也很不错。,5.0
王木杉19,数据结构比较难，但是老师深入浅出，讲的很好，习题也很充足,5.0
空山新雨mooc22,老师讲的很好，提问题也非常耐心的解答！,5.0
mooc1600011772,内容丰富，作业适当！,5.0
mightymac,讲的非常好,5.0
秦晓宇,老师讲得很棒！,5.0
本护1701_U201712776何志翔,真的很不错呀,5.0
madksou,老师讲解的非常好，如果能多一些代码实例就更好了。,5.0
陌mooc255,讲课细致，收获颇多，值得推荐,5.0
李佩佳,慢慢学习就有收获,4.0
mooc1511960214877,很好，特别好懂，但是更新太慢了，还有，图去哪呢，我怎么找不到第五章,5.0
mooc1520579116052,棒棒棒棒棒,5.0
王盒子,进度太慢了,3.0
叶子mooc447,这门课老师讲的很浅显易懂，适合初学者。,3.0
小林R,准备充足，课程流畅。但是，有的概念讲解似乎有点不够具体，需要再结合书本详细了解才可以,4.0
Dreamerykt1456564490335,对数据结构有基础的讲解，要是有了习题的讲解就更好了,3.0
JLXY2017020800220姚昊霖,66666666,5.0
Invictus潇,好的不得了,5.0
陈芷安2000,非常好，老师讲得很仔细，很用心，谢谢老师，交给了我们这么有用的程序设计方面的知识！希望以后还有更好的提高课程，我还会来学！,5.0
LeoooY,非常好，对我很有帮助,5.0
Deetiny,内容丰富，课堂生动，对我有很大的益处，感谢讲师，感谢这个平台,5.0
OceanExplorer,非常好的课程，内容清晰、老师讲解细致，学习起来轻松多了。最佩服的是，老师讲课时行云流水般的思维和逻辑，有一种美感。很高兴能参加这次课程的学习，受益良多！再次感谢！,5.0
Student6,课程很好，但我觉得一开始难度有点不适应，非计算机专业的我学着很吃力，后面就开始适应了,5.0
让世界知道我不认书,将的很透彻，适合系统的学习。,5.0
ELjing,讲解细致，希望每章加上综合对比总结。,4.0
mooc1510317679354,很好的一门课程!,5.0
ykt1521721665318,课程结构不错，由浅入深，内容也较全面，但老师在不少地方讲的都有些错误，有待提高。,4.0
Adda_Chen,；老师普通话可以在提高一些，，，，,5.0
CWUC--罗震,很棒强烈推荐,5.0
造雨人mooc2,老师讲得太棒了,5.0
浅蓝色gg,goodd,5.0
magical风铃,讲的很仔细，很多不懂的地方都会铺开讲，收获很多。,5.0
JmsAllen,讲得很清晰！,5.0
xiemenngdi,感觉很好，知识结构很清晰,5.0
9Found,老师讲得很好！！！！！！！！！！,5.0
小僵尸Rua,非常好，易懂，做得也很精美,5.0
小黄鸭咩咩咩,王曙燕老师和王燕老师对待哪怕是网络上的学生都很有耐心，这样的好老师请给我来一个连。,5.0
great1949,这门课程让我不再对KMP算法感到迷惘。,5.0
mooc心窗,课程质量很好，讲解的很清楚，对于据数结构这种比较难而且很重要的课程，最好利用这些课程对学过的知识加以巩固。,5.0
mooc1535355463179,真的太棒了！比我们昌大副院长老师讲的好多了，以一个领路人的身份带着我们思考，讲得非常细。强烈推荐！！！,5.0
xuptjk170115司灏,很不错，从算法结构中的时间与空间分析与各种算法的学习，是我更深刻的了解自己的所学。,5.0
mooc1529919846393,课程严密充实，对于编程初学者来说，可以有效地理解怎样将人类思维转变为计算机语言的过程。从而学习数据结构与算法非常有用,5.0
宝文理1702114张鹏哲,课程安排的紧凑而又细腻，便于我们学习，也能激起我的学习欲望，细节之处讲得十分细腻。,5.0
mooc1526956883021,非常感谢老师们在这段时间的辛勤付出！,5.0
加油瑞吖,课程较清晰易懂，老师讲的也很好，我自己学到了很多。谢谢老师们！,5.0
xuptrj170232宗世钰,非常有收获。,5.0
mooc1536324923396,找到了学习的地方,5.0
xuptdsj180135袁鑫怡,老师讲课的干货很多，学习之后受益匪浅，相信在之后的学习中数据结构和算法这门课程能取得很好的成绩,5.0
说一不二三hx,一直看这门课程，老师们讲解的都很浅显易懂，容易理解。,5.0
xuptrj170115杨文涛,课程很全面，每次章节结束后还有测试可以检验你学习的成果，视频加上文档使学习变得更简单化了,5.0
xuptrj170529李思琦,老师讲课细致，授课内容充实,5.0
xuptrj170208黄甫泓杭11,视频讲解非常详细，一针见血。,5.0
xuptrj170317韩旭鹏,课程整体还不错，网上做题真的是厉害,4.0
jxsdwct05,非常不错推荐,5.0
陌上花开_可缓缓归矣,老师讲解的通俗易懂，内容很不错，收获很多,5.0
王振宇mooc5,课程内容丰富，老师都讲的好精彩，太棒了！赞赞赞！,5.0
李保霖Leo_h,希望郭炜老师来讲这门课。递归转非递归那节张老师用词实在难懂，“本程”，“结构值”都不是我们常用的叫法,1.0
Nife_,学到了很多东西！,5.0
wzipone,看到大家的评论我就放心了,4.0
吴有肝,课程不错，不过课后讨论真的太难,5.0
bojohnzhang,很好！非常好！,5.0
1800013041,好好好好好,5.0
mooc1877337432373959,测试题描述模糊，难以下手。,1.0
还没吃饭,老师讲课很棒很清晰！,4.0
Christoher_Morcom,这就叫专业！之前我们学的数据结构，都是什么狗屁玩意儿。,4.0
刘俊杰mooc13,感觉讲的不怎么样,1.0
数媒1701李一泓,很棒！！！,5.0
wxc1234,一般吧，老师讲课不流畅,3.0
mooc34315820748791952,讲课没有条理和逻辑，感觉老师讲的时候没有备课,1.0
hit1180200721,。。。。。,5.0
IZOAmooc,Goodgood,5.0
梦淅,我一再确认，发现确实北京大学的课，emmm，拜拜了,3.0
mooc69137443984572531,优秀的一个课件,5.0
fjcsmart163com,在线学习很不错，老师措辞也很谨慎，非常推荐，看完留念。tips：1.25倍速感觉语速好很多。,5.0
alexgirl,很好的数据结构课程！,5.0
因果律的溶解,非常好，只可惜有几次作业忘了，过期了。,5.0
xuptjy031,课程内容精辟，老师讲课通俗易懂，让我学到了很多。,5.0
阳°二十,谢谢老师讲的这么透彻。,5.0
王逊茗,学到了很多数据结构的知识，为自己以后学习计算机方面的知识打下了基础，也产生了浓厚的兴趣，很感谢老师。,5.0
xuptjk04181208王嘉琪,感觉数据结构与算法的学习非常有意义对于思维的活跃也有一定的作用,5.0
xuptrj180302陈啸宇,棒！强烈推荐,5.0
xuptjk180727姜欣静,老师讲解认真详细，容易理解，课后练习起到很大的巩固作用,5.0
XUPT06191001,干货，非常棒,5.0
知有通时,老师讲的特别好，我这种没什么基础的人也听得懂,5.0
魏亦文,这门数据结构与算法课对石油勘探数据处理很有用,5.0
xuptjk170334张妮娟,老师讲解的都非常好，通过学习这门课，收获了很多的知识，提高了自己。,5.0
计科1702韩佳豪,课程讲解内容简单易懂，适合初学者，而且能利用生活中的一些常见例子来说清楚一些不宜懂的理论，非常适合新手,5.0
xuptrj170226俞党玲,讲的很细，很全面,5.0
hilkant,简介，重点明确,5.0
木白mooc61,巩固了基础知识,5.0
mooc1531186409602,超级棒，点赞,5.0
xutg161504吴卓越,老师们讲的十分生动，线上线下教学结合的方法十分有益。,5.0
xupt18jy047付稳稳,老师授课循序渐进，非常清晰，讨论区答疑也很及时，看完能够对数据结构有系统化的认知，适合对数据结构感到头疼的同学学习。,5.0
xuptjk180522孙哲俊,经过这段时间的学习让我深刻了解到了数据结构在计算机程序设计中的重要性。,5.0
闷声吖,课程讲的很好。,5.0
xuptjk180730黄妍,老师讲课清晰，可以了解许多新知识,5.0
赵沅彤,知识点详细易懂,5.0
lilinlin100,课程很简单易懂，但是因为我是大一并且C课程才上刚开始的时候有很多算法无法实现，所以时间来不及。希望在7月份能够继续学习。,5.0
H先生嘻嘻,老师讲的不错，不懂的地方还会补上视频,5.0
陈允扬,老师讲得很好，学习效果很不错,5.0
NovakChan,老师讲的很深入，有讨论用的QQ群，大家都比较活跃，适合新手或者想复习的同学看看，隔壁北大老师的适合提高或者课后练习使用，想打基础的同学先用这个，再看张老师的就差不多了。,5.0
sx18215603126163com,这门课程对于我这个非计算机专业的太友好了，找了很多课程，这应该是最详细，讲的最深入的一门了。感谢电子科大的老师们！立帖为证，这门课必成国家精品。,5.0
¦    かpp℡Cc,和大学课堂学到的很相似，十分有用！,5.0
木子文伊口,老师讲得还是很详细的,5.0
陈乔怀古,学的还不错,4.0
kin3z,最满意是有实操示范，这个非常好。,5.0
傻傻的我_2017,课程讲解清楚,4.0
siomlwd,老师讲的很详细,5.0
季长云,适合像我这样的初学者，讲得很细致，谢谢老师不是精品课程不科学,5.0
the SKY with the HELIO,老师每个知识点都讲解的非常详细，程序的讲解也都十分清晰，如果老师可以讲一点题目就好了。,5.0
喔噢哦嚄,非常细致思路清晰比看书肯定是容易一些,5.0
